title,release_date,runtime,overview,vote_average
The Girl on the Mat,2016-10-14,27,"""The Girl on the Mat"" is a sports drama about Hayden, a high school female wrestler poised to be the champion of her state as she struggles with her Mother's health and her team-mate's abusive behavior.",10.0
Log Boy,2018-12-24,2,"A woodsman, who loves chopping wood, is relentlessly pestered by a boy made out of logs",8.5
Ihsan: The Movie,2019-12-09,3,"A parody of Joker, tells the fictional true story of Ihsan, a young man struggling in Gotham City",10.0
Shudhu Tomari Jonyo,2015-10-16,149,Adi is devastated after his girlfriend's death while Nayantara is left in shock after her boyfriend leaves her. Adi and Nayantara get married to each other but find it difficult to forget their past.,8.0
Come Back Home,2018-12-22,20,"Having a car accident at night, a man comes to a strange house nearby to ask for help. What he sees in the house makes him more confused and worried.",8.0
Bouffée d'air frais,2023-02-16,7,"A 21 year old Frenchman, driven insane by the banality of working class life, takes an impromptu trip to the beach.",8.0
Closeness,2023-02-14,3,It's been 2 years since they've been together. They haven't seen each other in person. Only pixels on a screen.,10.0
A short film about a kid,2024-05-07,4,While he was playing video games his controller dies,10.0
Lateef,2015-06-05,118,"Lateef is a middle-class man who aspires to become a doctor. But, this dream is shattered when he gets arrested in a drug raid.",8.0
The Master Gardener VOL. 1: The Curve of Destiny,2023-10-13,10,"An epic journey of a gardener fighting different hitmen after he finds a mysterious object called: ""The curve of destiny""",10.0
The Players,2019-05-20,5,"Arthur studies at the library of his high school. Sarah, near him, looks at him with interest. Nothing prepared them for what awaited them, behind the door.",10.0
Kolej Havası,2019-09-06,115,A documentary about Beşiktaş and soccer.,8.5
Queens Of Combat QOC 19,2017-11-26,112,"QUEENS OF COMBAT 19 will once again delight us with its show, an invitation to stars from different federations and countries of the show will be held at the Benton Convention Center Winston-Salem, NC 11/26/17 Do not miss the main battle Su Yung Mickie Knuckles vs. Samantha Heights.",10.0
Queens of Combat QOC 2,2014-06-14,120,"Episode Two of the Queens Court is now Online and features a new first round match announcement. The Queen's Court Episode 2. THE QUEENS OF COMBAT TITLE TOURNAMENT!Sixteen competitors battle it out to become the first QoC Champion!Queens of Combat return to action on Saturday, June.",9.0
Child of Nature,2021-05-01,90,"An epic journey of courage, hope and generosity, filmed in 15 countries. Child of Nature follows 5 connected stories of young people who, against all odds are transforming their lives and the lives of those around them.",10.0
ROW Ladies Night Out 5,2019-02-23,90,"Title Match Network will be holding its fifth Ladies Night Out event this Saturday. Ladies Night Out is a recurring all-women show that began last February. Due to its success, TMN decided to run three more editions in 2018 alone. Now entering the new year, they will be running Ladies Night Out 5, running out of Booker T’s Reality of Wrestling (ROW)‘s World Gym Arena. In January, ROW collaborated with RISE Wrestling to create the excellent ROW on the RISE show, which showed many homegrown ROW talents against RISE stars. Seven exciting matchups are on the card for Ladies Night Out 5. It’s available to stream live on the Title Match Network, where you can watch all preceding Ladies Night Out events, as well as many others, with a 2 week free trial.",10.0
